[
  {
    "schema_version": "1.0.0",
    "id": "corr_01K0ABCDEFFGHJKMNPQRSTVWXD",
    "publication_id": "pub_MB76FYPQZ5RTPENBAR5611AJJ0",
    "type": "correcao-factual",
    "published_at": "2026-07-20T16:10:00-03:00",
    "summary": "O horário correto da interrupção é 7h42, não 7h24.",
    "impact": "A cronologia foi corrigida sem alterar a conclusão estrutural da reportagem.",
    "previous_revision": 1,
    "new_revision": 2
  }
]
